{
  "id": "cafe-and-pastry",
  "name": "Cafe & Pastry",
  "slug": "cafe-and-pastry",
  "icon": "☕🥐",
  "description": "Designed for beverage-first establishments centered on artisanal espresso and specialty tea craft, accompanied by a curated display of fine pâtisserie and morning bakes. Tailored for venues where pastries are sourced or baked in limited daily batches without a full-scale bread production line.",
  "category": "cafe",
  "tags": [
    "cafe",
    "coffee",
    "pastry",
    "patisserie",
    "dessert",
    "tea"
  ],
  "sections": [
    {
      "id": "espresso-and-coffee",
      "name": "Espresso & Coffee",
      "sortOrder": 1,
      "description": "Core coffee program encompassing handcrafted espresso beverages, batch filter drip, and single-origin pour-overs. This section is required as coffee craft forms the foundational identity and primary daily volume of a cafe & pastry venue.",
      "isRequired": true,
      "isDefaultVisible": true,
      "icon": "☕",
      "subSections": [
        {
          "id": "espresso-based-drinks",
          "name": "Espresso-Based Drinks",
          "sortOrder": 1,
          "description": "Traditional and modern espresso beverages prepared with dialed-in espresso extractions and expertly textured hot milk or water."
        },
        {
          "id": "brewed-and-pour-over",
          "name": "Brewed & Pour-Over",
          "sortOrder": 2,
          "description": "Batch-brewed drip coffees and manual single-origin filter methods highlighting distinct regional coffee bean origins and terroir."
        },
        {
          "id": "specialty-coffee",
          "name": "Specialty Coffee",
          "sortOrder": 3,
          "description": "Barista-crafted specialty creations, seasonal spiced coffee drinks, signature house lattes, and affogatos."
        }
      ],
      "itemOptions": [
        {
          "id": "drink-size",
          "type": "single-select",
          "label": "Cup Size",
          "isRequired": true,
          "choices": [
            { "value": "small", "label": "Small (8 oz)", "priceModifier": 0 },
            { "value": "medium", "label": "Medium (12 oz)", "priceModifier": 0.5 },
            { "value": "large", "label": "Large (16 oz)", "priceModifier": 1.0 }
          ]
        },
        {
          "id": "milk-alternative",
          "type": "single-select",
          "label": "Milk Selection",
          "isRequired": false,
          "choices": [
            { "value": "whole-milk", "label": "Whole Milk", "priceModifier": 0 },
            { "value": "skim-milk", "label": "Skim Milk", "priceModifier": 0 },
            { "value": "oat-milk", "label": "Oat Milk", "priceModifier": 0.75 },
            { "value": "almond-milk", "label": "Almond Milk", "priceModifier": 0.75 },
            { "value": "soy-milk", "label": "Soy Milk", "priceModifier": 0.75 },
            { "value": "coconut-milk", "label": "Coconut Milk", "priceModifier": 0.75 }
          ]
        },
        {
          "id": "extra-shot",
          "type": "single-select",
          "label": "Espresso Shots",
          "isRequired": false,
          "choices": [
            { "value": "standard", "label": "Standard Recipe", "priceModifier": 0 },
            { "value": "single-extra", "label": "Add Extra Espresso Shot (+1)", "priceModifier": 0.9 },
            { "value": "double-extra", "label": "Add Double Espresso Shot (+2)", "priceModifier": 1.6 },
            { "value": "decaf", "label": "Decaffeinated Espresso", "priceModifier": 0 }
          ]
        },
        {
          "id": "sweetness-level",
          "type": "single-select",
          "label": "Sweetness Level",
          "isRequired": false,
          "choices": [
            { "value": "unsweetened", "label": "Unsweetened (0%)", "priceModifier": 0 },
            { "value": "less-sweet", "label": "Less Sweet (25%)", "priceModifier": 0 },
            { "value": "half-sweet", "label": "Half Sweet (50%)", "priceModifier": 0 },
            { "value": "regular-sweet", "label": "Regular Sweet (100%)", "priceModifier": 0 },
            { "value": "extra-sweet", "label": "Extra Sweet (120%)", "priceModifier": 0 }
          ]
        }
      ]
    },
    {
      "id": "tea-and-specialty-hot-drinks",
      "name": "Tea & Specialty Hot Drinks",
      "sortOrder": 2,
      "isRequired": false,
      "isDefaultVisible": true,
      "icon": "🫖",
      "description": "Premium loose-leaf teas, wellness infusions, and comforting non-coffee hot beverages. Caters to non-coffee drinkers, evening visitors, and guests seeking botanical teas, matcha lattes, spiced chai, or rich hot chocolate.",
      "subSections": [
        {
          "id": "classic-teas",
          "name": "Classic Teas",
          "sortOrder": 1,
          "description": "Carefully sourced loose-leaf black, green, white, and oolong teas steeped at designated water temperatures and precise durations."
        },
        {
          "id": "herbal-and-fruit-infusions",
          "name": "Herbal & Fruit Infusions",
          "sortOrder": 2,
          "description": "Naturally caffeine-free herbal tisanes, floral blossoms, soothing botanicals, and dried fruit infusions."
        },
        {
          "id": "specialty-lattes-and-hot-drinks",
          "name": "Specialty Lattes & Hot Drinks",
          "sortOrder": 3,
          "description": "Steamed artisan beverages including ceremonial stone-ground matcha, house-spiced masala chai, golden turmeric latte, and artisan hot chocolates."
        }
      ],
      "itemOptions": [
        {
          "id": "tea-size",
          "type": "single-select",
          "label": "Cup Size",
          "isRequired": true,
          "choices": [
            { "value": "regular", "label": "Regular (12 oz)", "priceModifier": 0 },
            { "value": "large", "label": "Large (16 oz)", "priceModifier": 0.6 }
          ]
        },
        {
          "id": "milk-alternative",
          "type": "single-select",
          "label": "Milk Selection",
          "isRequired": false,
          "choices": [
            { "value": "whole-milk", "label": "Whole Milk", "priceModifier": 0 },
            { "value": "skim-milk", "label": "Skim Milk", "priceModifier": 0 },
            { "value": "oat-milk", "label": "Oat Milk", "priceModifier": 0.75 },
            { "value": "almond-milk", "label": "Almond Milk", "priceModifier": 0.75 },
            { "value": "soy-milk", "label": "Soy Milk", "priceModifier": 0.75 },
            { "value": "coconut-milk", "label": "Coconut Milk", "priceModifier": 0.75 }
          ]
        },
        {
          "id": "sweetness-level",
          "type": "single-select",
          "label": "Sweetness Level",
          "isRequired": false,
          "choices": [
            { "value": "unsweetened", "label": "Unsweetened (0%)", "priceModifier": 0 },
            { "value": "less-sweet", "label": "Less Sweet (25%)", "priceModifier": 0 },
            { "value": "half-sweet", "label": "Half Sweet (50%)", "priceModifier": 0 },
            { "value": "regular-sweet", "label": "Regular Sweet (100%)", "priceModifier": 0 }
          ]
        }
      ]
    },
    {
      "id": "cold-and-iced-drinks",
      "name": "Cold & Iced Drinks",
      "sortOrder": 3,
      "isRequired": false,
      "isDefaultVisible": true,
      "icon": "🧊",
      "description": "Chilled and refreshing beverages essential for warmer hours and cold drink enthusiasts. Comprises slow-steeped cold brew, iced espresso, freshly shaken iced teas, house lemonades, and velvety blended frappes.",
      "subSections": [
        {
          "id": "iced-coffee-and-cold-brew",
          "name": "Iced Coffee & Cold Brew",
          "sortOrder": 1,
          "description": "Cold-extracted single-origin brews, iced espresso tonics, iced lattes, and nitro draft pours served crisp over ice."
        },
        {
          "id": "iced-tea-and-lemonade",
          "name": "Iced Tea & Lemonade",
          "sortOrder": 2,
          "description": "Refreshing unsweetened and fruit-infused iced teas, sparkling botanical spritzers, and freshly squeezed citrus lemonades."
        },
        {
          "id": "blended-and-frappe",
          "name": "Blended & Frappe",
          "sortOrder": 3,
          "description": "Smooth ice-blended coffee frappes, matcha blends, and fruit-based blended beverages topped with artisan cold foam or whipped cream."
        }
      ],
      "itemOptions": [
        {
          "id": "cold-drink-size",
          "type": "single-select",
          "label": "Cup Size",
          "isRequired": true,
          "choices": [
            { "value": "regular", "label": "Regular (16 oz)", "priceModifier": 0 },
            { "value": "large", "label": "Large (24 oz)", "priceModifier": 0.75 }
          ]
        },
        {
          "id": "milk-alternative",
          "type": "single-select",
          "label": "Milk Selection",
          "isRequired": false,
          "choices": [
            { "value": "whole-milk", "label": "Whole Milk", "priceModifier": 0 },
            { "value": "skim-milk", "label": "Skim Milk", "priceModifier": 0 },
            { "value": "oat-milk", "label": "Oat Milk", "priceModifier": 0.75 },
            { "value": "almond-milk", "label": "Almond Milk", "priceModifier": 0.75 },
            { "value": "soy-milk", "label": "Soy Milk", "priceModifier": 0.75 },
            { "value": "coconut-milk", "label": "Coconut Milk", "priceModifier": 0.75 }
          ]
        },
        {
          "id": "ice-level",
          "type": "single-select",
          "label": "Ice Level",
          "isRequired": false,
          "choices": [
            { "value": "no-ice", "label": "No Ice", "priceModifier": 0 },
            { "value": "less-ice", "label": "Less Ice", "priceModifier": 0 },
            { "value": "regular-ice", "label": "Regular Ice", "priceModifier": 0 },